{
  "schemaVersion": 1,
  "matrixVersion": "1.0.0",
  "retrievedAt": "2026-08-13",
  "launchGate": true,
  "baselines": [
    {"label":"stable","tag":"v4.0.14","commit":"15f9c35b9db69795325eab608fa00f11ef13a0a3","minimumOS":"macOS 15","sourceURL":"https://github.com/AerialScreensaver/Aerial/tree/v4.0.14"},
    {"label":"beta","tag":"v4.1.0beta13","commit":"0083c721dcc0fa6df55a0a011678c11493ad2810","minimumOS":"macOS 26","sourceURL":"https://github.com/AerialScreensaver/Aerial/tree/v4.1.0beta13"}
  ],
  "requiredDomains": ["install-update","screensaver-lock","wallpaper","fullscreen","apple-content","personal-media","playlists-channels","filters","live-feeds","content-packs","displays","time-solar","energy-lifecycle","transitions","overlays","cache","privacy","diagnostics","playback-details"],
  "requiredProductDirections": ["static","hybrid","advanced-live"],
  "crossCuttingConformance": {
    "resourceBudget": {"requirementRef":"https://github.com/MeekPhills/project-ambient/issues/28","applicability":"every-row","referenceTier":"base-2024-m4-mac-mini-16gb-256gb","measures":["cpu","memory","wakeups","gpu","decoder","network","storage-churn","frame-pacing"],"conformanceTest":{"id":"PAR-XCUT-M4","status":"planned","evidenceRefs":[],"smoke":"Run every row on the reference base M4 tier and attribute CPU, memory, wakeups, GPU, decoder, network, storage churn, and frame pacing."}},
    "chatControl": {"requirementRef":"https://github.com/MeekPhills/project-ambient/issues/29","applicability":"every-row","directMode":"required-for-setting-or-action","deterministicChatMode":"same-typed-command-required","nonActionBehavior":"explain-read-only-or-unsupported","conformanceTest":{"id":"PAR-XCUT-CHAT","status":"planned","evidenceRefs":[],"smoke":"For every row, verify the direct setting or action and deterministic chat use the same typed command, or present the same read-only or unsupported explanation."}}
  },
  "evidenceCatalog": [
    {"id":"stable-settings","kind":"source","sourceVersion":"v4.0.14","sourceCommit":"15f9c35b9db69795325eab608fa00f11ef13a0a3","retrievedAt":"2026-08-13","uri":"https://github.com/AerialScreensaver/Aerial/blob/15f9c35b9db69795325eab608fa00f11ef13a0a3/Aerial/UI/SwiftUI/Settings/SettingsView.swift","summary":"Stable settings surface used to bind behavior shared with the stable launch baseline."},
    {"id":"screensaver-settings","kind":"source","sourceVersion":"v4.1.0beta13","sourceCommit":"0083c721dcc0fa6df55a0a011678c11493ad2810","retrievedAt":"2026-08-13","uri":"https://github.com/AerialScreensaver/Aerial/blob/0083c721dcc0fa6df55a0a011678c11493ad2810/Aerial/UI/SwiftUI/Settings/Panels/ScreensaverSettingsPanel.swift","summary":"Screen saver registration, default selection, activation timing, and repair controls."},
    {"id":"wallpaper-settings","kind":"source","sourceVersion":"v4.1.0beta13","sourceCommit":"0083c721dcc0fa6df55a0a011678c11493ad2810","retrievedAt":"2026-08-13","uri":"https://github.com/AerialScreensaver/Aerial/blob/0083c721dcc0fa6df55a0a011678c11493ad2810/Aerial/UI/SwiftUI/Settings/Panels/DesktopSettingsPanel.swift","summary":"Wallpaper lifecycle, visibility, power, thermal, camera, continuity, and cache controls."},
    {"id":"display-settings","kind":"source","sourceVersion":"v4.1.0beta13","sourceCommit":"0083c721dcc0fa6df55a0a011678c11493ad2810","retrievedAt":"2026-08-13","uri":"https://github.com/AerialScreensaver/Aerial/blob/0083c721dcc0fa6df55a0a011678c11493ad2810/Aerial/UI/SwiftUI/Settings/Panels/DisplaysSettingsPanel.swift","summary":"Display targeting, synchronization, aspect, spanning, mirroring, and margin controls."},
    {"id":"time-settings","kind":"source","sourceVersion":"v4.1.0beta13","sourceCommit":"0083c721dcc0fa6df55a0a011678c11493ad2810","retrievedAt":"2026-08-13","uri":"https://github.com/AerialScreensaver/Aerial/blob/0083c721dcc0fa6df55a0a011678c11493ad2810/Aerial/UI/SwiftUI/Settings/Panels/TimeSettingsPanel.swift","summary":"Location, Night Shift, appearance, manual solar rules, windows, and preview behavior."},
    {"id":"cache-settings","kind":"source","sourceVersion":"v4.1.0beta13","sourceCommit":"0083c721dcc0fa6df55a0a011678c11493ad2810","retrievedAt":"2026-08-13","uri":"https://github.com/AerialScreensaver/Aerial/blob/0083c721dcc0fa6df55a0a011678c11493ad2810/Aerial/UI/SwiftUI/Settings/Panels/CacheSettingsPanel.swift","summary":"Cache size, location, replacement, network trust, and backup exclusion controls."},
    {"id":"advanced-settings","kind":"source","sourceVersion":"v4.1.0beta13","sourceCommit":"0083c721dcc0fa6df55a0a011678c11493ad2810","retrievedAt":"2026-08-13","uri":"https://github.com/AerialScreensaver/Aerial/blob/0083c721dcc0fa6df55a0a011678c11493ad2810/Aerial/UI/SwiftUI/Settings/Panels/AdvancedSettingsPanel.swift","summary":"Formats, fades, audio, battery, orientation, language, logging, and reset behavior."},
    {"id":"accessibility-settings","kind":"source","sourceVersion":"v4.1.0beta13","sourceCommit":"0083c721dcc0fa6df55a0a011678c11493ad2810","retrievedAt":"2026-08-13","uri":"https://github.com/AerialScreensaver/Aerial/blob/0083c721dcc0fa6df55a0a011678c11493ad2810/Aerial/UI/SwiftUI/Settings/Panels/AccessibilityPanel.swift","summary":"Reduced motion, keyboard shortcuts, solid surfaces, and video color inversion."},
    {"id":"update-settings","kind":"source","sourceVersion":"v4.1.0beta13","sourceCommit":"0083c721dcc0fa6df55a0a011678c11493ad2810","retrievedAt":"2026-08-13","uri":"https://github.com/AerialScreensaver/Aerial/blob/0083c721dcc0fa6df55a0a011678c11493ad2810/Aerial/UI/SwiftUI/Settings/Panels/AutoUpdatesPanel.swift","summary":"Sparkle-backed update cadence, automatic installation, beta channel, and manual checks."},
    {"id":"personal-media","kind":"source","sourceVersion":"v4.1.0beta13","sourceCommit":"0083c721dcc0fa6df55a0a011678c11493ad2810","retrievedAt":"2026-08-13","uri":"https://github.com/AerialScreensaver/Aerial/blob/0083c721dcc0fa6df55a0a011678c11493ad2810/Aerial/UI/SwiftUI/Settings/Panels/MyVideosViewModel.swift","summary":"Personal MOV and MP4 copy import, collision handling, metadata, and unsupported files."},
    {"id":"first-launch-migration","kind":"source","sourceVersion":"v4.1.0beta13","sourceCommit":"0083c721dcc0fa6df55a0a011678c11493ad2810","retrievedAt":"2026-08-13","uri":"https://github.com/AerialScreensaver/Aerial/blob/0083c721dcc0fa6df55a0a011678c11493ad2810/Aerial/UI/FirstLaunch/FirstLaunchMigrationStep.swift","summary":"First-run detection and user choice for legacy cache migration, fresh defaults, and optional reclamation."},
    {"id":"download-accessibility","kind":"source","sourceVersion":"v4.1.0beta13","sourceCommit":"0083c721dcc0fa6df55a0a011678c11493ad2810","retrievedAt":"2026-08-13","uri":"https://github.com/AerialScreensaver/Aerial/blob/0083c721dcc0fa6df55a0a011678c11493ad2810/Aerial/Model/DownloadCoordinator.swift","summary":"Download completion lifecycle and VoiceOver announcements for completed video downloads."},
    {"id":"video-inspector","kind":"source","sourceVersion":"v4.1.0beta13","sourceCommit":"0083c721dcc0fa6df55a0a011678c11493ad2810","retrievedAt":"2026-08-13","uri":"https://github.com/AerialScreensaver/Aerial/blob/0083c721dcc0fa6df55a0a011678c11493ad2810/Aerial/UI/VideoBrowser/VideoInspectorView.swift","summary":"Video metadata, selection, download, favorites, hidden state, and direct actions."},
    {"id":"playlist-manager","kind":"source","sourceVersion":"v4.1.0beta13","sourceCommit":"0083c721dcc0fa6df55a0a011678c11493ad2810","retrievedAt":"2026-08-13","uri":"https://github.com/AerialScreensaver/Aerial/blob/0083c721dcc0fa6df55a0a011678c11493ad2810/Aerial/Model/UserPlaylistManager.swift","summary":"Named playlist persistence, ordered entries, cycle modes, and import or export behavior."},
    {"id":"video-browser","kind":"source","sourceVersion":"v4.1.0beta13","sourceCommit":"0083c721dcc0fa6df55a0a011678c11493ad2810","retrievedAt":"2026-08-13","uri":"https://github.com/AerialScreensaver/Aerial/blob/0083c721dcc0fa6df55a0a011678c11493ad2810/Aerial/UI/VideoBrowser/VideoBrowserState.swift","summary":"Source browsing, filtering, selection, search, activity, and current browser state."},
    {"id":"live-feeds","kind":"source","sourceVersion":"v4.1.0beta13","sourceCommit":"0083c721dcc0fa6df55a0a011678c11493ad2810","retrievedAt":"2026-08-13","uri":"https://github.com/AerialScreensaver/Aerial/blob/0083c721dcc0fa6df55a0a011678c11493ad2810/Aerial/Model/LiveFeedManager.swift","summary":"HLS, YouTube, and RTSP feed lifecycle, duration, credentials, reload, and persistence."},
    {"id":"live-tooling","kind":"source","sourceVersion":"v4.1.0beta13","sourceCommit":"0083c721dcc0fa6df55a0a011678c11493ad2810","retrievedAt":"2026-08-13","uri":"https://github.com/AerialScreensaver/Aerial/blob/0083c721dcc0fa6df55a0a011678c11493ad2810/Aerial/Model/LiveFeedsTooling.swift","summary":"External helper discovery and explicit setup needed for YouTube and RTSP sources."},
    {"id":"expansions","kind":"source","sourceVersion":"v4.1.0beta13","sourceCommit":"0083c721dcc0fa6df55a0a011678c11493ad2810","retrievedAt":"2026-08-13","uri":"https://github.com/AerialScreensaver/Aerial/blob/0083c721dcc0fa6df55a0a011678c11493ad2810/Aerial/UI/VideoBrowser/ExpansionsContentView.swift","summary":"Expansion discovery, link installation, progress, source enablement, and removal."},
    {"id":"overlay-settings","kind":"source","sourceVersion":"v4.1.0beta13","sourceCommit":"0083c721dcc0fa6df55a0a011678c11493ad2810","retrievedAt":"2026-08-13","uri":"https://github.com/AerialScreensaver/Aerial/blob/0083c721dcc0fa6df55a0a011678c11493ad2810/Aerial/UI/SwiftUI/Settings/Panels/OverlaysSettingsPanel.swift","summary":"Per-display overlay layout, separate modes, login hiding, startup version, and rotation."},